{
  "schema_version": 1,
  "event_research_version": "event-research-v1",
  "target_date": "2026-08-12",
  "previous_trading_day": "2026-08-10",
  "event_research_started_at": "2026-08-09T09:00:00+09:00",
  "event_gate_as_of": "2026-08-11T21:00:00+09:00",
  "strategy_version": "v1",
  "config_sha256": "b4ff2bd42ee1eeaefe451edaa2ec0d0957bfd27726f2972ad4f896a5c78e8e09",
  "input_hashes": {
    "candidate_pipeline_sha256": "3ab4d7a0cb14e949a1f191f36980670dfd2d050cee4a07745cd0a256cd2962a8",
    "candidates_sha256": "10c1425de7c8e5f559593589ecb52a3bc19a51326b1aab5d581c7f950444d5d6",
    "strategy_snapshot_sha256": "f81751ed61f6b1843fb5b3722cb2cfb0cc06c0580bdd73026bba099d96686236"
  },
  "event_gate_input_tickers": [
    "7203"
  ],
  "candidates": [
    {
      "ticker": "7203",
      "selected_attempt_ids": {
        "earnings_schedule_jpx": null,
        "earnings_schedule_issuer": null,
        "tdnet": null,
        "issuer_disclosure": null,
        "yahoo_news": null,
        "kabutan_news": null
      },
      "news_classifications": []
    }
  ]
}
